### ISSUE TITLE
etcd v2.2.1 tries to connect directly to member even when you run local proxy

### ISSUE THREAD

**Issue by kayrus** [coreos/etcd#3805]
This issue was reported by tittof from etcd IRC channel. I've tried to reproduce it and here are my results:

* coreos1 (192.168.122.143) - etcd member
* coreos2 (192.168.122.2) - etcd member
* coreos3 (192.168.122.71) - etcd proxy

I run etcdctl on coreos3 and look for strace and tcpdump results:

```
coreos3 ~ # strace etcdctl --debug ls /128 2>&1 | grep sa_family=AF_INET
bind(3, {sa_family=AF_INET6, sin6_port=htons(0), inet_pton(AF_INET6, "::1", &sin6_addr), sin6_flowinfo=0, sin6_scope_id=0}, 28) = 0
bind(4, {sa_family=AF_INET6, sin6_port=htons(0), inet_pton(AF_INET6, "::ffff:127.0.0.1", &sin6_addr), sin6_flowinfo=0, sin6_scope_id=0}, 28) = 0
connect(5, {sa_family=AF_INET, sin_port=htons(2379), sin_addr=inet_addr("127.0.0.1")}, 16) = -1 EINPROGRESS (Operation now in progress)
getsockname(6, {sa_family=AF_INET, sin_port=htons(49934), sin_addr=inet_addr("192.168.122.71")}, [16]) = 0
connect(6, {sa_family=AF_INET, sin_port=htons(2379), sin_addr=inet_addr("192.168.122.143")}, 16) = -1 EINPROGRESS (Operation now in progress)
```

```
14:47:12.863382 IP coreos3.49934 > coreos1.2379: Flags [S], seq 3546867370, win 29200, options [mss 1460,sackOK,TS val 898136 ecr 0,nop,wscale 6], length 0
E..<R.@.@.q...zG..z...  K.h........r.vV.........
.X........
14:47:12.863550 IP coreos1.2379 > coreos3.49934: Flags [S.], seq 1258281781, ack 3546867371, win 28960, options [mss 1460,sackOK,TS val 900660 ecr 898136,nop,wscale 6], length 0
E..<..@.@.....z...zG    K..J..5.h....q vV.........
.X....
14:47:12.863611 IP coreos3.49934 > coreos1.2379: Flags [.], ack 1, win 457, options [nop,nop,TS val 898136 ecr 900660], length 0
E..4R.@.@.q...zG..z...  K.h..J..6....vN.....
.4.
14:47:12.864414 IP coreos3.49934 > coreos1.2379: Flags [P.], seq 1:147, ack 1, win 457, options [nop,nop,TS val 898137 ecr 900660], length 146
E...R.@.@.q...zG..z...  K.h..J..6....v......
.4GET /v2/keys/128?quorum=false&recursive=false&sorted=false HTTP/1.1
Host: coreos1:2379
User-Agent: Go-http-client/1.1
Accept-Encoding: gzip


14:47:12.864535 IP coreos1.2379 > coreos3.49934: Flags [.], ack 147, win 470, options [nop,nop,TS val 900662 ecr 898137], length 0
E..4e.@.@._...z...zG    K..J..6.h.=....vN.....
.Y.
14:47:12.864715 IP coreos1.2379 > coreos3.49934: Flags [P.], seq 1:243, ack 147, win 470, options [nop,nop,TS val 900662 ecr 898137], length 242
E..&e.@.@.^...z...zG    K..J..6.h.=....w@.....
.YHTTP/1.1 404 Not Found
Content-Type: application/json
X-Etcd-Cluster-Id: fa15befb7584f0da
X-Etcd-Index: 838
Date: Wed, 04 Nov 2015 13:47:12 GMT
Content-Length: 71

{"errorCode":100,"message":"Key not found","cause":"/128","index":838}

14:47:12.864765 IP coreos3.49934 > coreos1.2379: Flags [.], ack 243, win 473, options [nop,nop,TS val 898137 ecr 900662], length 0
E..4R.@.@.q...zG..z...  K.h.=J..(....vN.....
.6.
14:47:12.865523 IP coreos3.49934 > coreos1.2379: Flags [F.], seq 147, ack 243, win 473, options [nop,nop,TS val 898138 ecr 900662], length 0
E..4R.@.@.q...zG..z...  K.h.=J..(....vN.....
.6.
14:47:12.865624 IP coreos1.2379 > coreos3.49934: Flags [F.], seq 243, ack 148, win 470, options [nop,nop,TS val 900663 ecr 898138], length 0
E..4e.@.@._...z...zG    K..J..(.h.>....vN.....
.Z.
14:47:12.865680 IP coreos3.49934 > coreos1.2379: Flags [.], ack 244, win 473, options [nop,nop,TS val 898138 ecr 900663], length 0
E..4R.@.@.q...zG..z...  K.h.>J..)....vN.....
.7.
```

I'm not sure why etcdctl on coreos3 initializes connection directly with coreos1 instead of using local etcd2 proxy. This issue is reproducible from time to time (~1 of 4)

**Comment by xiang90** [comment]
@kayrus If you want the etcdctl to only connect to local proxy, you need to start it withy --no-sync flag. Or it will sync the cluster info via proxy and then bypass it afterwards.

**Comment by xiang90** [comment]
@kayrus We might add proxy awareness client to stick with the given proxy in the future. But for etcdctl, no-sync should be good enough.

**Comment by kayrus** [comment]
@xiang90 what do you mean when say "sync the cluster"? does sync include get request to get the key value?

**Comment by xiang90** [comment]
@kayrus Sync cluster updates the cluster member list.

**Comment by kayrus** [comment]
@xiang90 if you review tcpdump, you'll see that etcdctl gets info directly from member. it doesn't look like a sync

**Comment by xiang90** [comment]
@kayrus 

etcdctl first syncs the cluster, gets the actual member list. Then it uses the member list got to get the key from the actual etcd member.

Or I will be surprised that how etcdctl acutally gets the list of the members that you never tell it.

I am not sure if you provided the full tcpdump. Actually you should just provide the log of etcdctl with --debug.

**Comment by kayrus** [comment]
@xiang90 looks like I didn't use -f flag for tcpdump. so as I understand proxy will work like a regular proxy only when you use --no-sync flag? otherwise proxy will return only member list, right?

**Comment by xiang90** [comment]
@kayrus The proxy is just a normal reverse proxy. etcdctl decides which etcd server it wants to connect to. 

First it syncs the cluster via proxy to the real etcd cluster addresses. Then etcdctl WILL use the new cluster address instead of the original proxy one you gave it. So you need to stop etcdctl from syncing the cluster.

> otherwise proxy will return only member list, right?

I do not quite follow this.

**Comment by kayrus** [comment]
@xiang90 
> The proxy is just a normal reverse proxy
> etcdctl decides which etcd server it wants to connect to

now it looks clear. but my opinion - etcdctl should not decide that if it uses proxy. it should connect to proxy address only.
